{"$schema":"https://json-schema.org/draft/2020-12/schema","$id":"https://ilka.local/schemas/captain-day-view.schema.json","title":"CaptainDayView","type":"object","additionalProperties":false,"required":["expedition_id","local_date","day","stage","participants","blockers","can_close_day","sync_status","controls","outputs","expedition_status","expedition_completion","completion_readiness"],"properties":{"expedition_id":{"type":"string"},"local_date":{"type":"string","format":"date"},"day":{"type":"object","required":["number","stage_id","status"],"properties":{"number":{"type":"integer"},"stage_id":{"type":"string"},"status":{"enum":["not_started","active","review","closed","transition_failed"]},"boundary_at":{"type":"string","format":"date-time"},"revision":{"type":"integer","minimum":1},"superseded_day_numbers":{"type":"array","items":{"type":"integer","minimum":1,"maximum":12},"uniqueItems":true},"transition_mode":{"enum":["automatic","forced","rewound"]}},"additionalProperties":false},"participants":{"type":"array","items":{"type":"object","required":["participant_id","product_role_id","onboard_role_id","required_cards_acknowledged","required_tasks_terminal"],"properties":{"participant_id":{"type":"string"},"product_role_id":{"type":"string"},"onboard_role_id":{"type":"string"},"required_cards_acknowledged":{"type":"boolean"},"required_tasks_terminal":{"type":"boolean"},"overdue_task_count":{"type":"integer","minimum":0},"sync_status":{"enum":["synced","pending","conflict","rejected","offline"]},"status":{"enum":["active","banned"]},"access_revoked":{"type":"boolean"}},"additionalProperties":false}},"blockers":{"type":"array","items":{"type":"object","required":["code","message","entity_id"],"properties":{"code":{"type":"string"},"message":{"type":"string"},"entity_id":{"type":"string"}},"additionalProperties":false}},"can_close_day":{"type":"boolean"},"controls":{"type":"object","required":["override_day_close","recover_day_transition","activate_recovery_day","override_role_assignment","request_stage_advance","advance_stage","override_stage_advance","close_expedition"],"properties":{"override_day_close":{"type":"boolean"},"recover_day_transition":{"type":"boolean"},"activate_recovery_day":{"type":"boolean"},"override_role_assignment":{"type":"boolean"},"normal_start_day":{"const":false},"request_stage_advance":{"type":"boolean"},"advance_stage":{"type":"boolean"},"override_stage_advance":{"type":"boolean"},"force_day_transition":{"type":"boolean"},"rewind_day":{"type":"boolean"},"ban_participant":{"type":"boolean"},"unban_participant":{"type":"boolean"},"create_decision_draft":{"type":"boolean"},"create_vote":{"type":"boolean"},"finalize_product_decision":{"type":"boolean"},"override_product_decision":{"type":"boolean"},"close_expedition":{"type":"boolean"}},"additionalProperties":false},"sync_status":{"enum":["synced","pending","conflict","rejected","offline"]},"outputs":{"type":"array","items":{"type":"object","additionalProperties":false,"required":["output_id","required","confirmed","evidence_refs"],"properties":{"output_id":{"type":"string"},"required":{"type":"boolean"},"confirmed":{"type":"boolean"},"evidence_refs":{"type":"array","items":{"type":"string"}},"confirmed_by":{"type":["string","null"]},"pending_sync":{"type":"boolean"}}}},"stage":{"type":"object","additionalProperties":false,"required":["stage_id","status","next_stage_id","advance_request_status","can_advance"],"properties":{"stage_id":{"type":"string"},"status":{"enum":["locked","available","active","completed"]},"next_stage_id":{"type":["string","null"]},"advance_request_status":{"enum":["none","pending","synced","conflict","rejected"]},"requested_by":{"type":["string","null"]},"can_advance":{"type":"boolean"},"advance_blockers":{"type":"array","items":{"type":"object","required":["code","message"],"properties":{"code":{"type":"string"},"message":{"type":"string"}},"additionalProperties":false}}}},"super_admin":{"type":"object","additionalProperties":false,"required":["enabled","scope","server_confirmation_required"],"properties":{"enabled":{"const":true},"scope":{"const":"expedition"},"server_confirmation_required":{"const":true},"can_delete_events":{"const":false},"can_impersonate_system_clock":{"const":false}}},"decision":{"type":["object","null"],"additionalProperties":false,"required":["status"],"properties":{"status":{"enum":["none","draft","vote_open","finalized","overridden"]},"decision_id":{"type":["string","null"]},"vote_id":{"type":["string","null"]},"round_version":{"type":["integer","null"],"minimum":1},"eligible_voter_ids":{"type":"array","items":{"type":"string"},"uniqueItems":true},"effective_ballot_count":{"type":"integer","minimum":0},"abstention_count":{"type":"integer","minimum":0},"selected_option_id":{"type":["string","null"]},"can_finalize":{"type":"boolean"},"blockers":{"type":"array","items":{"type":"object","required":["code","message"],"properties":{"code":{"type":"string"},"message":{"type":"string"}},"additionalProperties":false}}}},"gamification_summary":{"type":["object","null"],"additionalProperties":false,"required":["rules_version","snapshot_at","entries","pending_verifications"],"properties":{"rules_version":{"type":"integer","minimum":1},"snapshot_at":{"type":"string","format":"date-time"},"entries":{"type":"array","items":{"type":"object","additionalProperties":false,"required":["participant_id","score","rank","status"],"properties":{"participant_id":{"type":"string","pattern":"^[a-z0-9_]+$"},"score":{"type":"number","minimum":0,"maximum":100},"rank":{"type":["integer","null"],"minimum":1},"status":{"enum":["active","inactive","not_enough_data"]}}}},"pending_verifications":{"type":"array","items":{"type":"object","additionalProperties":false,"required":["assignment_id","participant_id","role_id","role_type"],"properties":{"assignment_id":{"type":"string","pattern":"^[a-z0-9_]+$"},"participant_id":{"type":"string","pattern":"^[a-z0-9_]+$"},"role_id":{"type":"string","pattern":"^[a-z0-9_]+$"},"role_type":{"enum":["product","onboard"]}}}}}},"expedition_status":{"enum":["draft","ready","active","suspended","completed","cancelled"]},"expedition_completion":{"type":["object","null"],"additionalProperties":false,"required":["completed_at","final_stage_id","final_day_number","shore_package_ref","completion_summary","final_projection_version"],"properties":{"completed_at":{"type":"string","format":"date-time"},"final_stage_id":{"const":"demo_day"},"final_day_number":{"const":12},"shore_package_ref":{"type":"string","minLength":1},"completion_summary":{"type":"string","minLength":1},"final_projection_version":{"type":"integer","minimum":1}}},"completion_readiness":{"type":"object","additionalProperties":false,"required":["state","can_close_expedition","final_stage_id","final_day_number","shore_package_ref","expected_projection_version","blockers"],"properties":{"state":{"enum":["unavailable","blocked","ready","completed"]},"can_close_expedition":{"type":"boolean"},"final_stage_id":{"oneOf":[{"const":"demo_day"},{"type":"null"}]},"final_day_number":{"type":["integer","null"],"minimum":1,"maximum":12},"shore_package_ref":{"type":["string","null"]},"expected_projection_version":{"type":"integer","minimum":0},"blockers":{"type":"array","items":{"type":"object","additionalProperties":false,"required":["code","message"],"properties":{"code":{"type":"string"},"message":{"type":"string"},"entity_id":{"type":["string","null"]}}}}}}},"allOf":[{"$comment":"expedition completion projection invariant","if":{"properties":{"expedition_status":{"const":"completed"}},"required":["expedition_status"]},"then":{"properties":{"expedition_completion":{"type":"object"}}},"else":{"properties":{"expedition_completion":{"type":"null"}}}}]}